[
  {
    "id": "fi-oral-epreuve-deroule",
    "category": "notion",
    "title": "Le déroulé de l'oral de l'EAF",
    "level": "essentiel",
    "order": 0,
    "tags": ["oral", "épreuve", "déroulé"],
    "statement": "L'oral de l'Épreuve Anticipée de Français se compose de **30 minutes de préparation** suivies de **20 minutes d'épreuve** devant l'examinateur. Il est noté sur **20** et compte pour le **coefficient 5** (autant que l'écrit).\n\n**Le jour de l'oral :**\n\n1. L'examinateur **choisit un texte** dans votre descriptif et vous indique le **passage précis** à expliquer ainsi que la **question de grammaire**.\n2. Vous disposez de **30 minutes** pour préparer cette première partie (au brouillon, avec votre texte annoté).\n3. Pendant les **20 minutes d'épreuve**, vous enchaînez :\n   - **1ʳᵉ partie (12 pts)** : lecture à voix haute → explication linéaire → question de grammaire.\n   - **2ᵈᵉ partie (8 pts)** : présentation d'une œuvre que **vous** avez choisie, puis entretien avec l'examinateur.\n\nLa première partie occupe environ **12 minutes**, la seconde environ **8 minutes**.",
    "simplified": {
      "core": "30 min de préparation, puis 20 min d'épreuve. Sur 20, coefficient 5. Deux parties : explication linéaire (12 pts) puis présentation d'œuvre et entretien (8 pts).",
      "mnemonic": "30 + 20, sur 20, coef 5",
      "keyword": "déroulé",
      "accent": "blue"
    }
  },
  {
    "id": "fi-oral-epreuve-bareme",
    "category": "notion",
    "title": "Le barème détaillé (sur 20)",
    "level": "essentiel",
    "order": 1,
    "tags": ["oral", "barème", "notation"],
    "statement": "L'oral est noté **sur 20 points**, répartis en deux parties.\n\n**1ʳᵉ partie — 12 points**\n\n| Épreuve | Points |\n|---|---|\n| Lecture à voix haute du texte | **2** |\n| Explication linéaire du passage | **8** |\n| Question de grammaire | **2** |\n\n**2ᵈᵉ partie — 8 points**\n\n| Épreuve | Points |\n|---|---|\n| Présentation d'une œuvre choisie par le candidat + entretien | **8** |\n\n**Ce qu'il faut retenir :**\n\n- L'**explication linéaire** est le cœur de l'épreuve (8 pts) : c'est là que tout se joue.\n- La **lecture** et la **grammaire** rapportent chacune 2 points faciles à sécuriser : ne les négligez pas.\n- La **2ᵈᵉ partie** pèse autant que l'explication linéaire (8 pts) : préparez votre présentation d'œuvre à l'avance.",
    "simplified": {
      "core": "12 pts pour la 1ʳᵉ partie (lecture 2 + explication linéaire 8 + grammaire 2) et 8 pts pour la 2ᵈᵉ partie (présentation d'œuvre + entretien).",
      "mnemonic": "2 + 8 + 2 = 12, puis 8",
      "keyword": "barème",
      "accent": "amber"
    }
  },
  {
    "id": "fi-oral-epreuve-apporter",
    "category": "notion",
    "title": "Ce qu'il faut apporter le jour de l'oral",
    "level": "a-connaitre",
    "order": 2,
    "tags": ["oral", "descriptif", "œuvres", "organisation"],
    "statement": "Vous devez vous présenter à l'oral avec **deux types de documents indispensables**.\n\n**1. Le descriptif (ou récapitulatif des lectures)**\n\nC'est le document officiel, établi par votre professeur, qui liste **toutes les lectures linéaires** étudiées dans l'année (en général **16 à 24 textes**) réparties sur les **4 objets d'étude**. L'examinateur **choisit le texte** à expliquer **dans ce descriptif** : il ne peut pas vous interroger sur un texte qui n'y figure pas.\n\n**2. Les œuvres et les textes**\n\n- Apportez les **œuvres intégrales** et les **textes** correspondant au descriptif.\n- Les textes peuvent être **annotés** dans les limites autorisées (pas de rédaction complète de l'analyse au crayon).\n\n**Conseils pratiques :**\n\n- Vérifiez que votre descriptif est **signé/tamponné** par l'établissement.\n- Apportez **plusieurs exemplaires** ou photocopies de vos textes.\n- Prévoyez de quoi écrire au brouillon (l'examinateur fournit les feuilles).",
    "simplified": {
      "core": "Apportez le descriptif (liste des 16 à 24 textes étudiés) et les œuvres/textes. L'examinateur choisit le texte à expliquer dans le descriptif.",
      "mnemonic": "Descriptif + œuvres = obligatoires",
      "keyword": "descriptif",
      "accent": "emerald"
    }
  },
  {
    "id": "fi-oral-epreuve-preparation-30min",
    "category": "methode",
    "title": "Gérer les 30 minutes de préparation",
    "level": "essentiel",
    "order": 3,
    "tags": ["oral", "préparation", "gestion du temps", "méthode"],
    "statement": "Les **30 minutes de préparation** ne concernent que la **1ʳᵉ partie** (lecture + explication linéaire + grammaire). La 2ᵈᵉ partie (présentation d'œuvre) doit être préparée **chez vous, avant l'épreuve**.\n\n**Minutage conseillé :**\n\n| Temps | Tâche |\n|---|---|\n| **0–3 min** | Relire le passage, repérer le **projet de lecture** (problématique) |\n| **3–8 min** | Découper le texte en **mouvements** (2 à 4) et noter leurs **bornes** |\n| **8–22 min** | Analyser au fil du texte : **procédé → effet → citation** pour chaque mouvement |\n| **22–26 min** | Rédiger l'**introduction** (situation, projet de lecture, annonce des mouvements) et la **conclusion** (bilan + ouverture) |\n| **26–29 min** | Traiter la **question de grammaire** : identifier → justifier → analyser |\n| **29–30 min** | Préparer la **lecture à voix haute** (repérer pauses et liaisons) |\n\n**Conseils :**\n\n- Ne rédigez **pas** l'explication au mot près : notez des **mots-clés** et les **citations** repérées.\n- Gardez du temps pour la grammaire : c'est 2 points souvent négligés.\n- Numérotez vos notes pour pouvoir les suivre pendant l'oral.",
    "simplified": {
      "core": "30 min pour la 1ʳᵉ partie seulement : projet de lecture, découpage en mouvements, analyse procédé/effet/citation, intro + conclusion, grammaire, puis lecture.",
      "mnemonic": "Projet → mouvements → analyse → intro/conclu → grammaire",
      "keyword": "30 minutes",
      "accent": "violet"
    }
  }
]
