[
  {
    "id": "fi-oral-grammaire-subordonnees",
    "category": "notion",
    "title": "Les propositions subordonnées",
    "level": "essentiel",
    "order": 0,
    "tags": ["oral", "grammaire", "subordonnées", "syntaxe"],
    "statement": "Une **proposition subordonnée** dépend d'une autre proposition (la principale) : elle ne peut pas exister seule. On l'analyse en trois temps : **nature → mot introducteur → fonction**.\n\n**1. La subordonnée relative**\n\n- Introduite par un **pronom relatif** : *qui, que, dont, où, lequel*…\n- Elle complète un **nom** (l'antécédent) : sa fonction est **complément de l'antécédent** (épithète).\n- Ex. : *Le livre **qui est sur la table** est à moi.* → *qui est sur la table* complète *le livre*.\n\n**2. La subordonnée conjonctive complétive**\n\n- Introduite par la conjonction **que** (parfois *à ce que*, *de ce que*).\n- Elle complète un **verbe** : sa fonction est le plus souvent **COD**.\n- Ex. : *Je pense **que tu as raison**.* → *que tu as raison* est COD de *pense*.\n\n**3. Les subordonnées circonstancielles**\n\nElles complètent la **principale** (fonction : complément circonstanciel) et expriment une circonstance. Repérez-les par leur **conjonction de subordination** :\n\n| Sens | Mots introducteurs | Exemple |\n|---|---|---|\n| **Temps** | *quand, lorsque, dès que, avant que* | *Quand il pleut, je reste.* |\n| **Cause** | *parce que, puisque, comme* | *Comme il pleut, je reste.* |\n| **Conséquence** | *si bien que, de sorte que, tant que* | *Il pleut si bien que je reste.* |\n| **But** | *pour que, afin que* | *Je sors afin que tu te reposes.* |\n| **Condition** | *si, à condition que, pourvu que* | *Si tu veux, je viens.* |\n| **Concession** | *bien que, quoique, même si* | *Bien qu'il pleuve, je sors.* |\n\n**Méthode d'analyse :**\n\n1. **Identifier** : où commence et finit la subordonnée ? quel est son mot introducteur ?\n2. **Justifier** : pronom relatif → relative ; *que* après un verbe → complétive ; conjonction circonstancielle → circonstancielle (préciser le sens).\n3. **Analyser** : quelle est sa **fonction** (complément de l'antécédent, COD, complément circonstanciel) et son **rôle** dans la phrase ?",
    "example": "*J'attends **que le train arrive**.*\n\n- **Identifier** : la subordonnée est *que le train arrive*, introduite par *que*.\n- **Justifier** : *que* introduit ici une proposition qui complète le verbe *attends* (et non un nom) → **conjonctive complétive**.\n- **Analyser** : elle est **COD** du verbe *attends*.\n\n*La maison **où je suis né** a été vendue.*\n\n- **Identifier** : subordonnée *où je suis né*, introduite par *où*.\n- **Justifier** : *où* est un **pronom relatif** renvoyant à *la maison* (antécédent) → **relative**.\n- **Analyser** : elle complète le nom *maison*, fonction **complément de l'antécédent**.",
    "simplified": {
      "core": "Relative (pronom relatif qui/que/dont/où → complète un nom), complétive (que après un verbe → COD), circonstancielle (conjonction → temps, cause, conséquence, but, condition, concession). Identifier → justifier (mot introducteur) → analyser (fonction).",
      "mnemonic": "Relative = nom, complétive = verbe, circonstancielle = circonstance",
      "keyword": "subordonnées",
      "accent": "blue"
    }
  },
  {
    "id": "fi-oral-grammaire-interrogation",
    "category": "notion",
    "title": "L'interrogation",
    "level": "essentiel",
    "order": 1,
    "tags": ["oral", "grammaire", "interrogation", "syntaxe"],
    "statement": "Analyser une interrogation, c'est préciser **deux axes** : porte-t-elle sur **toute** la phrase ou sur **un élément** ? est-elle posée **directement** ou **rapportée** dans une autre phrase ?\n\n**1. Totale ou partielle ?**\n\n- **Totale** : on répond par **oui / non**. Elle porte sur l'ensemble de la phrase. Ex. : *Viens-tu ?*\n- **Partielle** : on attend une information précise. Elle porte sur **un élément** et utilise un **mot interrogatif** (*qui, que, quoi, où, quand, comment, pourquoi, combien, quel*). Ex. : *Quand viens-tu ?*\n\n**2. Directe ou indirecte ?**\n\n- **Directe** : question posée telle quelle, avec un **point d'interrogation**. Ex. : *Es-tu prêt ?*\n- **Indirecte** : question **rapportée** dans une subordonnée, sans point d'interrogation. Ex. : *Je te demande **si tu es prêt**.* (totale indirecte) ; *Je demande **où tu vas**.* (partielle indirecte)\n\n**3. Les marques de l'interrogation directe**\n\n| Marque | Niveau de langue | Exemple |\n|---|---|---|\n| **Inversion** sujet-verbe | soutenu | *Viens-tu ?* |\n| ***est-ce que*** | courant | *Est-ce que tu viens ?* |\n| **Intonation** seule (ordre normal) | familier/oral | *Tu viens ?* |\n| **Mot interrogatif** | toutes situations | *Pourquoi pars-tu ?* |\n\n**Méthode d'analyse :**\n\n1. **Identifier** : est-ce une interrogation ? directe (point d'interrogation) ou indirecte (subordonnée) ?\n2. **Justifier** : repérer les **marques** (inversion, *est-ce que*, mot interrogatif, intonation).\n3. **Analyser** : totale ou partielle ? quel **effet** (niveau de langue, vivacité, question rhétorique) ?",
    "example": "*Pourquoi ne m'as-tu rien dit ?*\n\n- **Identifier** : interrogation **directe** (point d'interrogation).\n- **Justifier** : marques = mot interrogatif *pourquoi* + **inversion** du sujet (*m'as-tu*).\n- **Analyser** : interrogation **partielle** (elle porte sur la cause). L'inversion relève d'un registre soutenu.\n\n*Je me demande **s'il viendra**.*\n\n- **Identifier** : interrogation **indirecte** (pas de point d'interrogation ; subordonnée après *je me demande*).\n- **Justifier** : introduite par *si*.\n- **Analyser** : interrogation **totale** indirecte (réponse oui/non attendue).",
    "simplified": {
      "core": "Deux axes : totale (oui/non) ou partielle (mot interrogatif) ; directe (point d'interrogation) ou indirecte (subordonnée). Marques : inversion, est-ce que, mots interrogatifs, intonation.",
      "mnemonic": "Totale/partielle + directe/indirecte",
      "keyword": "interrogation",
      "accent": "amber"
    }
  },
  {
    "id": "fi-oral-grammaire-negation",
    "category": "notion",
    "title": "La négation",
    "level": "essentiel",
    "order": 2,
    "tags": ["oral", "grammaire", "négation", "syntaxe"],
    "statement": "La négation permet de **nier** tout ou partie d'un énoncé. On l'analyse selon sa **portée** (sur quoi elle agit) et son **type**.\n\n**1. Négation totale ou partielle ?**\n\n- **Totale** : elle nie **toute** la phrase, avec *ne… pas* (ou *ne… point*). Ex. : *Il **ne** vient **pas**.*\n- **Partielle** : elle nie un **élément** précis grâce à un second terme variable :\n  - *ne… plus* (le temps), *ne… jamais* (la fréquence), *ne… rien* (les choses), *ne… personne* (les personnes), *ne… aucun* (la quantité), *ne… nulle part* (le lieu). Ex. : *Je **ne** vois **personne**.*\n\n**2. Négation syntaxique ou lexicale ?**\n\n- **Syntaxique (grammaticale)** : exprimée par les **mots de négation** (*ne… pas*, *ne… jamais*…). Ex. : *Ce n'est pas possible.*\n- **Lexicale** : exprimée par le **sens d'un mot** (préfixe *in-*, *mal-*, *dé-*… ou vocabulaire négatif). Ex. : *C'est **impossible**.* / *l'**absence**, le **refus***.\n\n**3. La négation restrictive *ne… que***\n\n- *ne… que* n'exprime **pas** une négation mais une **restriction** : elle équivaut à *seulement*.\n- Ex. : *Il **ne** mange **que** des fruits.* = *Il mange seulement des fruits.*\n- Attention : ne pas confondre avec une vraie négation.\n\n**Méthode d'analyse :**\n\n1. **Identifier** : repérer la négation et ses **deux éléments** (*ne* + second terme).\n2. **Justifier** : syntaxique (mots de négation) ou lexicale (sens du mot) ? quel second terme ?\n3. **Analyser** : totale, partielle ou restrictive ? quelle est sa **portée** et son **effet** (insistance, atténuation, exclusion…) ?",
    "example": "*Personne ne lui répondit jamais.*\n\n- **Identifier** : négation avec *ne*, *personne* et *jamais*.\n- **Justifier** : négation **syntaxique** ; *personne* nie les êtres, *jamais* nie la fréquence.\n- **Analyser** : négation **partielle** (cumulée) ; sa portée renforce l'idée d'un isolement total.\n\n*Il ne reste qu'une heure.*\n\n- **Identifier** : structure *ne… que*.\n- **Justifier** : *ne… que* = tour **restrictif**.\n- **Analyser** : ce n'est **pas** une négation mais une **restriction** (= *il reste seulement une heure*), qui souligne le peu de temps.",
    "simplified": {
      "core": "Totale (ne… pas) ou partielle (ne… plus/jamais/rien/personne…). Syntaxique (mots de négation) ou lexicale (préfixes in-, dé-, mots négatifs). Attention : ne… que = restriction (seulement), pas une négation.",
      "mnemonic": "Totale/partielle, syntaxique/lexicale, ne… que = restriction",
      "keyword": "négation",
      "accent": "violet"
    }
  }
]
